cluster_id,clickbait_element,main_fact,new_title,hype_score,category,original_title,original_link
155,implying crypto can ease cost of living concerns,The ASA upheld complaints against Coinbase's adverts for trivializing investment risks.,UK bans Coinbase advertisements for trivializing cryptocurrency investment risks,6,Finance,UK bans Coinbase ads implying crypto can ease cost of living concerns,https://www.bbc.com/news/articles/cx2yv31482vo?at_medium=RSS&at_campaign=rss
156,accidental email,"Amazon confirmed it will cut 16,000 jobs.","Amazon announces 16,000 job cuts",6,Business,"Amazon confirms 16,000 job cuts after accidental email",https://www.bbc.com/news/articles/cx2ywzxlxnlo?at_medium=RSS&at_campaign=rss
157,free AI training for work,The government is providing online AI training for UK adults.,Government provides online AI training for UK adults,4,Education,Government offers UK adults free AI training for work,https://www.bbc.com/news/articles/cp37prvp072o?at_medium=RSS&at_campaign=rss
158,claims it is censoring content,TikTok US is responding to allegations of content suppression.,TikTok US addresses allegations of content suppression,6,Media,TikTok US pushes back on claims it is censoring content,https://www.bbc.com/news/articles/ckgjedpn8p8o?at_medium=RSS&at_campaign=rss
159,victors and carnage,Cisco CEO compares AI to the dotcom bubble.,Cisco CEO compares AI to the dotcom bubble.,6,Technology,"AI boom will produce victors and carnage, tech boss warns",https://www.bbc.com/news/articles/cr57p2ve8glo?at_medium=RSS&at_campaign=rss
160,not for everyone,Iran cut off internet access on 8 January following a government crackdown on protesters.,Iran restores partial internet access after January 8 shutdown,6,Technology,Iran's internet is returning - but not for everyone,https://www.bbc.com/news/articles/cz7y2ddgl23o?at_medium=RSS&at_campaign=rss
161,How would,Discussion on social media ban for individuals under 16,Discussion on social media ban for individuals under 16,4,Technology,How would a social media ban for under-16s work?,https://www.bbc.com/news/videos/cx2yep7l2j2o?at_medium=RSS&at_campaign=rss
162,Cool future tech,Latest trends and innovations at CES 2026 in Las Vegas.,Trends and innovations presented at CES 2026 in Las Vegas.,1,Technology,Tech Now,https://www.bbc.co.uk/iplayer/episode/m002qbkc?at_medium=RSS&at_campaign=rss
163,where the name comes from,Jimmy Wales discusses Wikipedia's origins with the BBC.,Jimmy Wales discusses the origins of Wikipedia with the BBC.,5,Technology,Wikipedia's Jimmy Wales on where the name comes from,https://www.bbc.com/news/videos/cql4076kyzeo?at_medium=RSS&at_campaign=rss
164,Tech Life,Humanoid robots are designed to assist with household chores.,Humanoid robots designed for household chores,5,Technology,Tech Life,https://www.bbc.co.uk/sounds/play/w3ct6zpz?at_medium=RSS&at_campaign=rss
165,Backlash against Musk's Grok AI,The UK government criticized changes to Grok AI image edits by X.,UK government criticizes changes to Grok AI image edits by X,6,Technology,Watch: Backlash against Musk's Grok AI explained,https://www.bbc.com/news/videos/c8x94zr8yxvo?at_medium=RSS&at_campaign=rss
166,,"Latest gadgets, assistive tech, and gaming releases in 2026.",Overview of upcoming technology and gaming in 2026,1,Technology,Tech Life,https://www.bbc.co.uk/sounds/play/w3ct6zpy?at_medium=RSS&at_campaign=rss
167,Watch:,Retailers are using AI technology to combat shoplifting.,Retailers implement AI technology to address shoplifting.,6,Technology,Watch: BBC reporter tests AI anti-shoplifting tech,https://www.bbc.com/news/videos/c98p1jg3p58o?at_medium=RSS&at_campaign=rss
168,Fascinating year in global tech,Highlights from the year in global technology,Highlights from the year in global technology,6,Technology,Tech Life,https://www.bbc.co.uk/sounds/play/w3ct6zpx?at_medium=RSS&at_campaign=rss
169,Can robots ever be graceful?,Firms are working to make robot motors more efficient and cheaper.,Firms are improving efficiency and cost of robot motors.,6,Technology,Can robots ever be graceful?,https://www.bbc.com/news/articles/c5y46356zzyo?at_medium=RSS&at_campaign=rss
